{
  "schema_version": 2,
  "cohort_id": "2026-10-22.core-candidate.1",
  "state": "candidate",
  "created_at": "2026-10-22T22:55:48Z",
  "profile": {
    "status": "candidate",
    "registry_path": "profiles/core-v1.json",
    "sha256": "b7e599c810aeda7cbedddccf342988205a54d1d5a96044c377baab6bc39143c2"
  },
  "spec": {
    "repository": "https://github.com/lazily-hub/lazily-spec",
    "commit": "b706c72201826678df53735e1501e179f63707b9",
    "tag": "v0.44.1"
  },
  "conformance_revision": "b706c72201826678df53735e1501e179f63707b9",
  "core_api_generation": 1,
  "wire_version": "1",
  "bindings": [
    {
      "id": "rust",
      "profile": "core-candidate",
      "source": {
        "repository": "https://github.com/lazily-hub/lazily-rs",
        "commit": "81fb1e7cc01d8b9f7f83b313a2e7867ea75b68c7",
        "tag": "v0.61.0"
      },
      "qualification_commit": "2c70f22fa5750c025fd93d7c20d3689d8ac8d887",
      "spec_revision": "b706c72201826678df53735e1501e179f63707b9",
      "fixture_revision": "b706c72201826678df53735e1501e179f63707b9",
      "core_api_generation": 1,
      "wire_version": "1",
      "core_imports": [
        "lazily"
      ],
      "toolchains": [
        {
          "name": "rust",
          "minimum": "1.88",
          "current": "1.97.0"
        }
      ],
      "compatibility": {
        "core_api": {
          "minimum": 1,
          "maximum": 1
        },
        "modules": []
      },
      "packages": [
        {
          "ecosystem": "cargo",
          "coordinate": "lazily",
          "version": "0.61.0",
          "artifacts": [
            {
              "uri": "https://crates.io/api/v1/crates/lazily/0.61.0/download",
              "file": "cohorts/artifacts/lazily-0.61.0.crate",
              "sha256": "dea0e947b3766b88f327012f0d8392fb5a5c702050933cbb19467dedd3273c12",
              "provenance": {
                "kind": "registry-integrity",
                "uri": "https://crates.io/api/v1/crates/lazily/0.61.0",
                "file": "cohorts/evidence/registry/rust.json",
                "sha256": "663282e75aba441169ecbe1c246c1c9c2abb3971b1436bc2fb95f0a50f01c723"
              },
              "registry": {
                "url": "https://crates.io/api/v1/crates/lazily/0.61.0",
                "status": "available",
                "checked_at": "2026-10-22T22:38:00Z",
                "metadata_file": "cohorts/evidence/registry/rust.json",
                "metadata_sha256": "663282e75aba441169ecbe1c246c1c9c2abb3971b1436bc2fb95f0a50f01c723"
              }
            }
          ]
        }
      ],
      "gates": [
        {
          "name": "profile",
          "status": "passed",
          "evidence_file": "cohorts/evidence/gates/rust.json",
          "evidence_sha256": "4c77c0436758384976b917d1ecb6b43ada1601982a6f23fc1ff0e6f5bbfcd2b0"
        },
        {
          "name": "api",
          "status": "passed",
          "evidence_file": "cohorts/evidence/gates/rust.json",
          "evidence_sha256": "4c77c0436758384976b917d1ecb6b43ada1601982a6f23fc1ff0e6f5bbfcd2b0"
        },
        {
          "name": "fixture",
          "status": "passed",
          "evidence_file": "cohorts/evidence/gates/rust.json",
          "evidence_sha256": "4c77c0436758384976b917d1ecb6b43ada1601982a6f23fc1ff0e6f5bbfcd2b0"
        },
        {
          "name": "package",
          "status": "passed",
          "evidence_file": "cohorts/evidence/gates/rust.json",
          "evidence_sha256": "4c77c0436758384976b917d1ecb6b43ada1601982a6f23fc1ff0e6f5bbfcd2b0"
        },
        {
          "name": "pre_publish_consumer",
          "status": "passed",
          "evidence_file": "cohorts/evidence/gates/rust.json",
          "evidence_sha256": "4c77c0436758384976b917d1ecb6b43ada1601982a6f23fc1ff0e6f5bbfcd2b0"
        },
        {
          "name": "published_consumer",
          "status": "passed",
          "evidence_file": "cohorts/evidence/gates/rust.json",
          "evidence_sha256": "4c77c0436758384976b917d1ecb6b43ada1601982a6f23fc1ff0e6f5bbfcd2b0"
        }
      ]
    },
    {
      "id": "javascript",
      "profile": "core-candidate",
      "source": {
        "repository": "https://github.com/lazily-hub/lazily-js",
        "commit": "0e51f1157cd200f083ec28f814e3c2a79d557fa8",
        "tag": "v0.37.0"
      },
      "qualification_commit": "c0970b2fc309c67d2b71b34706941e4bc16606ce",
      "spec_revision": "b706c72201826678df53735e1501e179f63707b9",
      "fixture_revision": "b706c72201826678df53735e1501e179f63707b9",
      "core_api_generation": 1,
      "wire_version": "1",
      "core_imports": [
        "@lazily-hub/lazily-js/reactive"
      ],
      "toolchains": [
        {
          "name": "node",
          "minimum": "24",
          "current": "24"
        }
      ],
      "compatibility": {
        "core_api": {
          "minimum": 1,
          "maximum": 1
        },
        "modules": []
      },
      "packages": [
        {
          "ecosystem": "npm",
          "coordinate": "@lazily-hub/lazily-js",
          "version": "0.37.0",
          "artifacts": [
            {
              "uri": "https://registry.npmjs.org/@lazily-hub/lazily-js/-/lazily-js-0.37.0.tgz",
              "file": "cohorts/artifacts/lazily-js-0.37.0.tgz",
              "sha256": "236076ec06a894930251960de2dface3d9f23bd9c419469b5743daaa0571456c",
              "provenance": {
                "kind": "registry-integrity",
                "uri": "https://registry.npmjs.org/@lazily-hub/lazily-js/0.37.0",
                "file": "cohorts/evidence/registry/javascript.json",
                "sha256": "170dd500c4e419b56dee819957c9064fb61ea4fbee2fdc19e0785c38b21bef39"
              },
              "registry": {
                "url": "https://registry.npmjs.org/@lazily-hub/lazily-js/0.37.0",
                "status": "available",
                "checked_at": "2026-10-22T22:38:00Z",
                "metadata_file": "cohorts/evidence/registry/javascript.json",
                "metadata_sha256": "170dd500c4e419b56dee819957c9064fb61ea4fbee2fdc19e0785c38b21bef39"
              }
            }
          ]
        }
      ],
      "gates": [
        {
          "name": "profile",
          "status": "passed",
          "evidence_file": "cohorts/evidence/gates/javascript.json",
          "evidence_sha256": "2d0bf5f12dd7c7d50c0762ceacd1a55de0682a01b7226eb32d7b333f1d19a84d"
        },
        {
          "name": "api",
          "status": "passed",
          "evidence_file": "cohorts/evidence/gates/javascript.json",
          "evidence_sha256": "2d0bf5f12dd7c7d50c0762ceacd1a55de0682a01b7226eb32d7b333f1d19a84d"
        },
        {
          "name": "fixture",
          "status": "passed",
          "evidence_file": "cohorts/evidence/gates/javascript.json",
          "evidence_sha256": "2d0bf5f12dd7c7d50c0762ceacd1a55de0682a01b7226eb32d7b333f1d19a84d"
        },
        {
          "name": "package",
          "status": "passed",
          "evidence_file": "cohorts/evidence/gates/javascript.json",
          "evidence_sha256": "2d0bf5f12dd7c7d50c0762ceacd1a55de0682a01b7226eb32d7b333f1d19a84d"
        },
        {
          "name": "pre_publish_consumer",
          "status": "passed",
          "evidence_file": "cohorts/evidence/gates/javascript.json",
          "evidence_sha256": "2d0bf5f12dd7c7d50c0762ceacd1a55de0682a01b7226eb32d7b333f1d19a84d"
        },
        {
          "name": "published_consumer",
          "status": "passed",
          "evidence_file": "cohorts/evidence/gates/javascript.json",
          "evidence_sha256": "2d0bf5f12dd7c7d50c0762ceacd1a55de0682a01b7226eb32d7b333f1d19a84d"
        }
      ]
    },
    {
      "id": "python",
      "profile": "core-candidate",
      "source": {
        "repository": "https://github.com/lazily-hub/lazily-py",
        "commit": "1a04b59bef8fb8b28fea280907c61dafc6b69873",
        "tag": "v0.45.0"
      },
      "qualification_commit": "62a6728f86ab216068c8d7d2bf363992c01d3c49",
      "spec_revision": "b706c72201826678df53735e1501e179f63707b9",
      "fixture_revision": "b706c72201826678df53735e1501e179f63707b9",
      "core_api_generation": 1,
      "wire_version": "1",
      "core_imports": [
        "lazily"
      ],
      "toolchains": [
        {
          "name": "python",
          "minimum": "3.12",
          "current": "3.14"
        }
      ],
      "compatibility": {
        "core_api": {
          "minimum": 1,
          "maximum": 1
        },
        "modules": []
      },
      "packages": [
        {
          "ecosystem": "pypi",
          "coordinate": "lazily",
          "version": "0.45.0",
          "artifacts": [
            {
              "uri": "https://files.pythonhosted.org/packages/8a/31/8330a247818fc69938d2e2c01e10bc4836cb65f7096e2e36d8b77774bad9/lazily-0.45.0.tar.gz",
              "file": "cohorts/artifacts/lazily-0.45.0.tar.gz",
              "sha256": "a5f39dc3af213d5bdf4c7103cd88d4b1e8ed39ec2e9fc9b5a3e1c1c631a65b5c",
              "provenance": {
                "kind": "registry-integrity",
                "uri": "https://pypi.org/pypi/lazily/0.45.0/json",
                "file": "cohorts/evidence/registry/python.json",
                "sha256": "72bc1ac0aedec52b5cef75fd05efed78e816215db29498bf5fe894f6aab1f9cc"
              },
              "registry": {
                "url": "https://pypi.org/pypi/lazily/0.45.0/json",
                "status": "available",
                "checked_at": "2026-10-22T22:38:00Z",
                "metadata_file": "cohorts/evidence/registry/python.json",
                "metadata_sha256": "72bc1ac0aedec52b5cef75fd05efed78e816215db29498bf5fe894f6aab1f9cc"
              }
            }
          ]
        }
      ],
      "gates": [
        {
          "name": "profile",
          "status": "passed",
          "evidence_file": "cohorts/evidence/gates/python.json",
          "evidence_sha256": "cd54699f20e8cd20b72c78131405dc3d2bd54072f5d7445b7d890cb667920747"
        },
        {